{"versionContrato":"sequias-1.0-m3-candidata","consulta":{"estado":"metodo_acordado","mesFinal":"2024-09","desde":"2024-07-01","hastaIncluido":"2024-09-30","zona":"UTC","provincia":"BO0701","municipio":"BO070101","muestra":"scz-piloto-01","referencia":{"desde":"1991-01-01","hastaIncluido":"2020-12-31","ventanaMeses":3},"obtencion":{"tipo":"cache","obtenidoEn":"2026-10-25T18:04:08.846370Z","esRespuestaHttp":true,"preparadoEn":"2026-10-25T18:13:48.133827Z","vigenteHasta":"2026-10-26T18:04:08.846370Z"}},"fuentes":[{"id":"open_meteo_era5","proveedor":"Open-Meteo","producto":"ERA5","naturaleza":"reanalisis","variable":"precipitation_sum","unidad":"mm","resolucionGrados":0.25,"licencia":"https:\/\/creativecommons.org\/licenses\/by\/4.0\/","atribucion":"Open-Meteo.com; ECMWF \/ Copernicus Climate Change Service, ERA5.","fechaActualizacion":null,"capturas":[{"identificador":"68870d9ba7fa4cd7e093b971fb83e4fec68d0b0243b929e22e872a41e4b51f1e","url":"https:\/\/archive-api.open-meteo.com\/v1\/archive?latitude=-17.7833&longitude=-63.1821&daily=precipitation_sum&models=era5&timezone=GMT&precipitation_unit=mm&cell_selection=nearest&elevation=nan&start_date=2024-07-01&end_date=2024-09-30","sha256":"a13f643eb39edb7a3e7edcef6aad0f8dab205cad6d10ed66497a5b8a61b6bf21","obtenidoEn":"2026-10-25T18:04:08.846370Z","periodo":{"desde":"2024-07-01","hastaIncluido":"2024-09-30","zona":"UTC"},"muestraOrigen":"scz-piloto-01"},{"identificador":"7642d10dab58e12edaf928a3d4548a3d7d804c74aa5c36d0fc585316ab51dd79","url":"https:\/\/archive-api.open-meteo.com\/v1\/archive?latitude=-17.7833&longitude=-63.1821&daily=precipitation_sum&models=era5&timezone=GMT&precipitation_unit=mm&cell_selection=nearest&elevation=nan&start_date=1990-11-01&end_date=2020-12-31","sha256":"5408b175da7efb0b6e896c10cd567f8b676181e9ecde4860c7602f385c7e3199","obtenidoEn":"2026-10-23T02:56:32.946304Z","periodo":{"desde":"1990-11-01","hastaIncluido":"2020-12-31","zona":"UTC"},"muestraOrigen":"scz-piloto-01"}]}],"resumen":{"totalMuestras":1,"muestrasConIndice":1,"muestrasSinIndice":0,"muestrasConDeficit":0,"spiMinimo":-0.6410480784168531,"unidadConteo":"muestras_no_superficie"},"cobertura":{"estadoEspacial":"muestras_puntuales","municipiosEnFiltro":1,"municipiosConMuestra":1,"municipiosConDatos":1,"municipiosConIndice":1,"celdasUnicas":1,"superficieEvaluadaKm2":null,"muestrasSeleccionadas":1,"muestrasSinPreparar":[],"estadoDatos":"completo_para_muestras_seleccionadas"},"advertencias":["Índice meteorológico propio de GeoCruz, derivado de ERA5; no es el SPI oficial de Copernicus ni una estación local.","Resultados de muestras puntuales: no representan promedio, superficie ni daño de todo el municipio.","La captura y su cálculo se prepararon fuera de esta petición; reutilizar no actualiza los datos históricos.","El centro de alguna celda pertenece a otro municipio o es ambiguo; se conserva el municipio de la muestra solicitada."]}
